<?xml version="1.0" encoding="UTF-8"?>

<header-normalization xmlns:xsi='http://www.w3.org/2001/XMLSchema-instance'
                      xmlns='http://docs.openrepose.org/repose/header-normalization/v1.0'
                      xsi:schemaLocation='http://docs.openrepose.org/repose/header-normalization/v1.0 ../config/header-normalization-configuration.xsd'>
    <!-- applies to all http methods (GET, POST, PUT, etc) that match the uri-regex -->
    <target uri-regex="/servers/(.*)">
        <response>
            <whitelist>
                <header id="X-Auth-Key"/>
                <header id="X-Auth-User"/>
            </whitelist>
        </response>
    </target>

    <!-- applies only to POST and PUT requests for /resource/(.*)-->
    <target uri-regex="/resource/(.*)" http-methods="POST PUT">
        <response>
            <whitelist>
                <header id="X-Modify"/>
            </whitelist>
        </response>
    </target>

    <!-- this blacklist filter only applies if the request does not match one of the previous targets -->
    <!-- since uri-regex and http-methods are not specified in target the blacklist applies to all http requests
         that don't match the previous two targets -->
    <target>
        <response>
            <blacklist>
                <header id="X-PP-User"/>
                <header id="X-PP-Groups"/>
            </blacklist>
        </response>
    </target>
</header-normalization>
